{
  "event_id": "pay-evt-7781",
  "transaction": {
    "transaction_id": "c6f8a706-4fae-49e3-9317-a765f2ef8b5e",
    "player_id": 33401,
    "amount": 125.0,
    "currency": "GBP",
    "payment_method": {"type": "card", "provider": "adyen"}
  },
  "risk_flags": ["new_device", "high_velocity"],
  "created_at": "2026-05-21T11:00:00Z"
}
